<?xml version="1.0" encoding="UTF-8"?>
<map xmlns:xsi='http://www.w3.org/2001/XMLSchema-instance'
     xmlns='http://myGame/tux' xsi:schemaLocation='http://myGame/tux ../xsd/map.xsd'>
    <skybox>
        <textureBottom>/textures/skybox/bottom.png</textureBottom>
        <textureEast>/textures/skybox/interstellar/east.png</textureEast>
        <textureWest>/textures/skybox/interstellar/west.png</textureWest>
        <textureNorth>/textures/skybox/interstellar/north.png</textureNorth>
        <textureSouth>/textures/skybox/interstellar/south.png</textureSouth>
        <textureTop>/textures/skybox/top.png</textureTop>
    </skybox>
    <room>
        <name>room1</name>
        <position>
            <x>0</x>
            <y>0</y>
            <z>0</z>
        </position>
        <dimensions>
            <x>1</x>
            <y>1</y>
            <z>1</z>
        </dimensions>
        <mapping>
            <textureBottom>/textures/floor/grass2.png</textureBottom>
            <textureWest>/textures/skybox/interstellar/west.png</textureWest>
            <textureEast>/textures/skybox/interstellar/east.png</textureEast>
            <textureNorth>/textures/skybox/interstellar/north.png</textureNorth>
        </mapping>
    </room>
    <cubes>
        <cube>
            <name>cube1</name>
            <position>
                <x>0</x>
                <y>0</y>
                <z>0</z>
            </position>
            <dimensions>
                <x>1</x>
                <y>1</y>
                <z>1</z>
            </dimensions>
            <mapping>
                <textureBottom>/textures/floor/grass2.png</textureBottom>
                <textureWest>/textures/skybox/interstellar/west.png</textureWest>
                <textureEast>/textures/skybox/interstellar/east.png</textureEast>
                <textureNorth>/textures/skybox/interstellar/north.png</textureNorth>
            </mapping>
        </cube>
    </cubes>
    <tux>
        <position>
            <x>0</x>
            <y>0</y>
            <z>0</z>
        </position>
        <rotation>
            <x>0</x>
            <y>0</y>
            <z>0</z>
        </rotation>
        <texture>/textures/tux/tux.png</texture>
    </tux>
    <plots>
        <plot>
            <name>plot1</name>
            <position>
                <x>0</x>
                <y>0</y>
                <z>0</z>
            </position>
            <dimensions>
                <x>1</x>
                <y>1</y>
                <z>1</z>
            </dimensions>
            <mapping>
                <textureBottom>/textures/floor/grass2.png</textureBottom>
                <textureEast>/textures/skybox/interstellar/east.png</textureEast>
                <textureWest>/textures/skybox/interstellar/west.png</textureWest>
                <textureNorth>/textures/skybox/interstellar/north.png</textureNorth>
            </mapping>
        </plot>
    </plots>
</map>